<?xml version="1.0" encoding="UTF-8"?>
<events xmlns:xsi="http://www.w3.org/2001/XMLSchema-instance" xsi:noNamespaceSchemaLocation="schemaEventDB.xsd">
      <event name="Fussball" id="1">
            <title>Fussballturnier</title>
            <dauerInTagen>3</dauerInTagen>
            <startdatum>2020-03-16</startdatum>
            <beschreibung>Dreitägiges Fussballturnier mit verschiedenen Disziplinen wie Torwandschiessen, Jonglieren sowie Teamspiele!</beschreibung>
            <handicap>
                  <behinderung>Psychische Behinderung</behinderung>
            </handicap>
            <anzahlMöglicheTeilnehmer>20</anzahlMöglicheTeilnehmer>
            <anzahlTeilnehmer>14</anzahlTeilnehmer>
            <findetStatt>true</findetStatt>
            <teilnehmerListe>
                  <teilnehmer>
                        <vorname>Hans</vorname>
                        <nachname>Michel</nachname>
                        <geschlecht>Anderes</geschlecht>
                        <adresse>Strasse 1</adresse>
                        <stadt>Burgdorf</stadt>
                        <telefonnummer>0834875937374</telefonnummer>
                        <geburtstag>1995-05-02</geburtstag>
                        <behinderung>Psychische Behinderung</behinderung>
                        <einzelzimmer>true</einzelzimmer>
                        <spezielles/>
                  </teilnehmer>
                  <teilnehmer>
                        <vorname>Hanna</vorname>
                        <nachname>Capital</nachname>
                        <geschlecht>Weiblich</geschlecht>
                        <adresse>Strasse 1</adresse>
                        <stadt>Burgdorf</stadt>
                        <telefonnummer>0834875937374</telefonnummer>
                        <geburtstag>1995-05-02</geburtstag>
                        <behinderung>Psychische Behinderung</behinderung>
                        <einzelzimmer>false</einzelzimmer>
                        <spezielles/>
                  </teilnehmer>
                  <teilnehmer>
                        <vorname>Frederico</vorname>
                        <nachname>Fischer</nachname>
                        <geschlecht>Weiblich</geschlecht>
                        <adresse>Elfenweg, 7</adresse>
                        <stadt>Burgdorf</stadt>
                        <telefonnummer>+41765205522</telefonnummer>
                        <geburtstag>2020-02-14</geburtstag>
                        <behinderung>Geistige Behinderung</behinderung>
                        <einzelzimmer>false</einzelzimmer>
                        <spezielles>asdf</spezielles>
                  </teilnehmer>
                  <teilnehmer>
                        <vorname>Frederico</vorname>
                        <nachname>Fischer</nachname>
                        <geschlecht>Weiblich</geschlecht>
                        <adresse>Elfenweg, 7</adresse>
                        <stadt>Burgdorf</stadt>
                        <telefonnummer>+41765205522</telefonnummer>
                        <geburtstag>2020-02-14</geburtstag>
                        <behinderung>Geistige Behinderung</behinderung>
                        <einzelzimmer>false</einzelzimmer>
                        <spezielles>asdf</spezielles>
                  </teilnehmer>
                  <teilnehmer>
                        <vorname>Frederico</vorname>
                        <nachname>Fischer</nachname>
                        <geschlecht>Männlich</geschlecht>
                        <adresse>Elfenweg, 7</adresse>
                        <stadt>Burgdorf</stadt>
                        <telefonnummer>+41765205522</telefonnummer>
                        <geburtstag>2020-02-21</geburtstag>
                        <behinderung>Keine Behinderung</behinderung>
                        <einzelzimmer>true</einzelzimmer>
                        <spezielles>asdf</spezielles>
                  </teilnehmer>
                  <teilnehmer>
                        <vorname>Frederico</vorname>
                        <nachname>Fischer</nachname>
                        <geschlecht>Anderes</geschlecht>
                        <adresse>Elfenweg, 7</adresse>
                        <stadt>Burgdorf</stadt>
                        <telefonnummer>+41765205522</telefonnummer>
                        <geburtstag>2020-02-22</geburtstag>
                        <behinderung>Höhrbehinderung</behinderung>
                        <einzelzimmer>true</einzelzimmer>
                        <spezielles>asd</spezielles>
                  </teilnehmer>
                  <teilnehmer>
                        <vorname>Frederico</vorname>
                        <nachname>Fischer</nachname>
                        <geschlecht>Anderes</geschlecht>
                        <adresse>Elfenweg, 7</adresse>
                        <stadt>Burgdorf</stadt>
                        <telefonnummer>+41765205522</telefonnummer>
                        <geburtstag>2020-02-22</geburtstag>
                        <behinderung>Höhrbehinderung</behinderung>
                        <einzelzimmer>true</einzelzimmer>
                        <spezielles>asd</spezielles>
                  </teilnehmer>
                  <teilnehmer>
                        <vorname>Frederico</vorname>
                        <nachname>Fischer</nachname>
                        <geschlecht>Anderes</geschlecht>
                        <adresse>Elfenweg, 7</adresse>
                        <stadt>Burgdorf</stadt>
                        <telefonnummer>+41765205522</telefonnummer>
                        <geburtstag>2020-02-22</geburtstag>
                        <behinderung>Höhrbehinderung</behinderung>
                        <einzelzimmer>true</einzelzimmer>
                        <spezielles>asd</spezielles>
                  </teilnehmer>
                  <teilnehmer>
                        <vorname>Frederico</vorname>
                        <nachname>Fischer</nachname>
                        <geschlecht>Anderes</geschlecht>
                        <adresse>Elfenweg, 7</adresse>
                        <stadt>Burgdorf</stadt>
                        <telefonnummer>+41765205522</telefonnummer>
                        <geburtstag>2020-02-22</geburtstag>
                        <behinderung>Höhrbehinderung</behinderung>
                        <einzelzimmer>true</einzelzimmer>
                        <spezielles>asd</spezielles>
                  </teilnehmer>
                  <teilnehmer>
                        <vorname>Frederico</vorname>
                        <nachname>Fischer</nachname>
                        <geschlecht>Weiblich</geschlecht>
                        <adresse>Elfenweg, 7</adresse>
                        <stadt>Burgdorf</stadt>
                        <telefonnummer>+41765205522</telefonnummer>
                        <geburtstag>2020-02-22</geburtstag>
                        <behinderung>Höhrbehinderung</behinderung>
                        <einzelzimmer>false</einzelzimmer>
                        <spezielles>asdf</spezielles>
                  </teilnehmer>
                  <teilnehmer>
                        <vorname>Frederico</vorname>
                        <nachname>Fischer</nachname>
                        <geschlecht>Weiblich</geschlecht>
                        <adresse>Elfenweg, 7</adresse>
                        <stadt>Burgdorf</stadt>
                        <telefonnummer>+41765205522</telefonnummer>
                        <geburtstag>2020-02-22</geburtstag>
                        <behinderung>Höhrbehinderung</behinderung>
                        <einzelzimmer>false</einzelzimmer>
                        <spezielles>asdf</spezielles>
                  </teilnehmer>
                  <teilnehmer>
                        <vorname>Frederico</vorname>
                        <nachname>Fischer</nachname>
                        <geschlecht>Weiblich</geschlecht>
                        <adresse>Elfenweg, 7</adresse>
                        <stadt>Burgdorf</stadt>
                        <telefonnummer>+41765205522</telefonnummer>
                        <geburtstag>2020-02-22</geburtstag>
                        <behinderung>Höhrbehinderung</behinderung>
                        <einzelzimmer>false</einzelzimmer>
                        <spezielles>asdf</spezielles>
                  </teilnehmer>
                  <teilnehmer>
                        <vorname>Frederico</vorname>
                        <nachname>Fischer</nachname>
                        <geschlecht>Weiblich</geschlecht>
                        <adresse>Elfenweg, 7</adresse>
                        <stadt>Burgdorf</stadt>
                        <telefonnummer>+41765205522</telefonnummer>
                        <geburtstag>2020-02-22</geburtstag>
                        <behinderung>Höhrbehinderung</behinderung>
                        <einzelzimmer>false</einzelzimmer>
                        <spezielles>asdf</spezielles>
                  </teilnehmer>
                  <teilnehmer>
                        <vorname>Nico</vorname>
                        <nachname>Iseli</nachname>
                        <geschlecht>Weiblich</geschlecht>
                        <adresse>Strasse</adresse>
                        <stadt>Luzern</stadt>
                        <telefonnummer>234234</telefonnummer>
                        <geburtstag>2020-02-28</geburtstag>
                        <behinderung>Psychische Behinderung</behinderung>
                        <einzelzimmer>true</einzelzimmer>
                        <spezielles/>
                  </teilnehmer>
            </teilnehmerListe>
      </event>



      <event name="Klettern" id="2">
            <title>Klettern in den Bergen</title>
            <dauerInTagen>4</dauerInTagen>
            <startdatum>2020-03-23</startdatum>